 redis Pulling 
 postgresql Pulling 
 rabbitmq Pulling 
 opensearch Pulling 
 redis Pulled 
 rabbitmq Pulled 
 postgresql Pulled 
 opensearch Pulled 
 Network docker_services_cli_default  Creating
 Network docker_services_cli_default  Created
 Container docker_services_cli-opensearch-1  Creating
 Container docker_services_cli-rabbitmq-1  Creating
 Container docker_services_cli-postgresql-1  Creating
 Container docker_services_cli-redis-1  Creating
 Container docker_services_cli-redis-1  Created
 Container docker_services_cli-opensearch-1  Created
 Container docker_services_cli-rabbitmq-1  Created
 Container docker_services_cli-postgresql-1  Created
 Container docker_services_cli-rabbitmq-1  Starting
 Container docker_services_cli-opensearch-1  Starting
 Container docker_services_cli-redis-1  Starting
 Container docker_services_cli-postgresql-1  Starting
 Container docker_services_cli-postgresql-1  Started
 Container docker_services_cli-redis-1  Started
 Container docker_services_cli-rabbitmq-1  Started
 Container docker_services_cli-opensearch-1  Started
============================= test session starts ==============================
platform linux -- Python 3.12.12, pytest-8.4.2, pluggy-1.6.0
rootdir: /home/runner/work/invenio-testrig/invenio-testrig/package-repo
configfile: pyproject.toml
testpaths: docs, tests, invenio_sitemap
plugins: github-actions-annotate-failures-0.3.0, pycodestyle-2.5.0, flask-1.3.0, black-ng-0.4.1, invenio-3.4.2, isort-4.0.0, cov-7.0.0, pydocstyle-2.4.0
collected 65 items

docs/conf.py ...                                                         [  4%]
tests/__init__.py ...                                                    [  9%]
tests/conftest.py ...                                                    [ 13%]
tests/fake_sitemap_sections.py ...                                       [ 18%]
tests/test_cache.py ...                                                  [ 23%]
tests/test_invenio_sitemap.py ......                                     [ 32%]
tests/test_sitemap.py ...
.....                                           [ 44%]
tests/test_sitemap_index.py ...
...                                       [ 53%]
tests/test_sitemap_root.py ...
...                                        [ 63%]
invenio_sitemap/__init__.py ...                                          [ 67%]
invenio_sitemap/cache.py ...                                             [ 72%]
invenio_sitemap/config.py ...                                            [ 76%]
invenio_sitemap/ext.py ...                                               [ 81%]
invenio_sitemap/sitemap.py ...                                           [ 86%]
invenio_sitemap/tasks.py ...                                             [ 90%]
invenio_sitemap/utils.py ...                                             [ 95%]
invenio_sitemap/views.py ...                                             [100%]

=============================== warnings summary ===============================
tests/test_sitemap.py::test_url_entries_generation
tests/test_sitemap.py::test_url_entries_generation
tests/test_sitemap_index.py::test_sitemap_entries_generation
tests/test_sitemap_index.py::test_sitemap_entries_generation
tests/test_sitemap_root.py::test_sitemap_root_enabled_by_default
tests/test_sitemap_root.py::test_sitemap_root_enabled_by_default
    self._set_cache(app, config)

- generated xml file: /home/runner/work/invenio-testrig/invenio-testrig/artifacts/test-report-patched.xml -
================================ tests coverage ================================
_______________ coverage: platform linux, python 3.12.12-final-0 _______________

Name                          Stmts   Miss  Cover   Missing
invenio_sitemap/__init__.py       6      0   100%
invenio_sitemap/cache.py         34      1    97%   60
invenio_sitemap/config.py         6      0   100%
invenio_sitemap/ext.py           12      0   100%
invenio_sitemap/sitemap.py        6      0   100%
invenio_sitemap/tasks.py         49      1    98%   66
invenio_sitemap/utils.py         13      0   100%
invenio_sitemap/views.py         31      0   100%
TOTAL                           157      2    99%
======================= 65 passed, 6 warnings in 10.10s ========================
 Container docker_services_cli-postgresql-1  Stopping
 Container docker_services_cli-redis-1  Stopping
 Container docker_services_cli-opensearch-1  Stopping
 Container docker_services_cli-rabbitmq-1  Stopping
 Container docker_services_cli-postgresql-1  Stopped
 Container docker_services_cli-postgresql-1  Removing
 Container docker_services_cli-postgresql-1  Removed
 Container docker_services_cli-redis-1  Stopped
 Container docker_services_cli-redis-1  Removing
 Container docker_services_cli-redis-1  Removed
 Container docker_services_cli-opensearch-1  Stopped
 Container docker_services_cli-opensearch-1  Removing
 Container docker_services_cli-opensearch-1  Removed
 Container docker_services_cli-rabbitmq-1  Stopped
 Container docker_services_cli-rabbitmq-1  Removing
 Container docker_services_cli-rabbitmq-1  Removed
 Network docker_services_cli_default  Removing
 Network docker_services_cli_default  Removed
