 postgresql Pulling 
 redis Pulling 
 rabbitmq Pulling 
 opensearch Pulling 
 redis Pulled 
 rabbitmq Pulled 
 postgresql Pulled 
 opensearch Pulled 
 Network docker_services_cli_default  Creating
 Network docker_services_cli_default  Created
 Container docker_services_cli-redis-1  Creating
 Container docker_services_cli-rabbitmq-1  Creating
 Container docker_services_cli-postgresql-1  Creating
 Container docker_services_cli-opensearch-1  Creating
 Container docker_services_cli-redis-1  Created
 Container docker_services_cli-postgresql-1  Created
 Container docker_services_cli-rabbitmq-1  Created
 Container docker_services_cli-opensearch-1  Created
 Container docker_services_cli-opensearch-1  Starting
 Container docker_services_cli-rabbitmq-1  Starting
 Container docker_services_cli-redis-1  Starting
 Container docker_services_cli-postgresql-1  Starting
 Container docker_services_cli-redis-1  Started
 Container docker_services_cli-postgresql-1  Started
 Container docker_services_cli-rabbitmq-1  Started
 Container docker_services_cli-opensearch-1  Started
============================= test session starts ==============================
platform linux -- Python 3.12.12, pytest-8.4.2, pluggy-1.6.0 -- /home/runner/work/invenio-testrig/invenio-testrig/package-repo/.venv/bin/python
cachedir: .pytest_cache
rootdir: /home/runner/work/invenio-testrig/invenio-testrig/package-repo
configfile: pyproject.toml
testpaths: docs, tests, invenio_sitemap
plugins: github-actions-annotate-failures-0.3.0, pycodestyle-2.5.0, flask-1.3.0, black-ng-0.4.1, invenio-3.4.2, isort-4.0.0, cov-7.0.0, pydocstyle-2.4.0
collecting ... collected 65 items

docs/conf.py::PYDOCSTYLE PASSED
docs/conf.py::ISORT PASSED
docs/conf.py::black PASSED
tests/__init__.py::PYDOCSTYLE PASSED
tests/__init__.py::ISORT PASSED
tests/__init__.py::black PASSED
tests/conftest.py::PYDOCSTYLE PASSED
tests/conftest.py::ISORT PASSED
tests/conftest.py::black PASSED
tests/fake_sitemap_sections.py::PYDOCSTYLE PASSED
tests/fake_sitemap_sections.py::ISORT PASSED
tests/fake_sitemap_sections.py::black PASSED
tests/test_cache.py::ISORT PASSED
tests/test_cache.py::black PASSED
tests/test_cache.py::test_base_sitemap_cache_iterate_keys PASSED
tests/test_invenio_sitemap.py::ISORT PASSED
tests/test_invenio_sitemap.py::black PASSED
tests/test_invenio_sitemap.py::test_version PASSED
tests/test_invenio_sitemap.py::test_init PASSED
tests/test_invenio_sitemap.py::test_config_defaults PASSED
tests/test_invenio_sitemap.py::test_config_override PASSED
tests/test_sitemap.py::ISORT PASSED
tests/test_sitemap.py::black PASSED
tests/test_sitemap.py::test_url_entries_generation PASSED

tests/test_sitemap.py::test_latest_lastmod PASSED
tests/test_sitemap.py::test_sitemap_404 PASSED
tests/test_sitemap.py::test_sitemap_has_valid_structure PASSED
tests/test_sitemap.py::test_sitemap_content PASSED
tests/test_sitemap.py::test_urls_eliminated_between_cache_refresh PASSED
tests/test_sitemap_index.py::ISORT PASSED
tests/test_sitemap_index.py::black PASSED
tests/test_sitemap_index.py::test_sitemap_entries_generation PASSED

tests/test_sitemap_index.py::test_sitemap_index_has_valid_structure PASSED
tests/test_sitemap_index.py::test_sitemap_index_content PASSED
tests/test_sitemap_index.py::test_iterate_urls_of_sitemap_indices PASSED
tests/test_sitemap_root.py::ISORT PASSED
tests/test_sitemap_root.py::black PASSED
tests/test_sitemap_root.py::test_sitemap_root_enabled_by_default PASSED

tests/test_sitemap_root.py::test_sitemap_root_disabled_when_configured PASSED
tests/test_sitemap_root.py::test_sitemap_root_empty_cache PASSED
tests/test_sitemap_root.py::test_sitemap_root_only_first_page PASSED
invenio_sitemap/__init__.py::PYDOCSTYLE PASSED
invenio_sitemap/__init__.py::ISORT PASSED
invenio_sitemap/__init__.py::black PASSED
invenio_sitemap/cache.py::PYDOCSTYLE PASSED
invenio_sitemap/cache.py::ISORT PASSED
invenio_sitemap/cache.py::black PASSED
invenio_sitemap/config.py::PYDOCSTYLE PASSED
invenio_sitemap/config.py::ISORT PASSED
invenio_sitemap/config.py::black PASSED
invenio_sitemap/ext.py::PYDOCSTYLE PASSED
invenio_sitemap/ext.py::ISORT PASSED
invenio_sitemap/ext.py::black PASSED
invenio_sitemap/sitemap.py::PYDOCSTYLE PASSED
invenio_sitemap/sitemap.py::ISORT PASSED
invenio_sitemap/sitemap.py::black PASSED
invenio_sitemap/tasks.py::PYDOCSTYLE PASSED
invenio_sitemap/tasks.py::ISORT PASSED
invenio_sitemap/tasks.py::black PASSED
invenio_sitemap/utils.py::PYDOCSTYLE PASSED
invenio_sitemap/utils.py::ISORT PASSED
invenio_sitemap/utils.py::black PASSED
invenio_sitemap/views.py::PYDOCSTYLE PASSED
invenio_sitemap/views.py::ISORT PASSED
invenio_sitemap/views.py::black PASSED

=============================== warnings summary ===============================
tests/test_sitemap.py::test_url_entries_generation
tests/test_sitemap.py::test_url_entries_generation
tests/test_sitemap_index.py::test_sitemap_entries_generation
tests/test_sitemap_index.py::test_sitemap_entries_generation
tests/test_sitemap_root.py::test_sitemap_root_enabled_by_default
tests/test_sitemap_root.py::test_sitemap_root_enabled_by_default
    self._set_cache(app, config)

- generated xml file: /home/runner/work/invenio-testrig/invenio-testrig/artifacts/test-report-patched.xml -
================================ tests coverage ================================
_______________ coverage: platform linux, python 3.12.12-final-0 _______________

Name                          Stmts   Miss  Cover   Missing
invenio_sitemap/__init__.py       6      0   100%
invenio_sitemap/cache.py         34      1    97%   60
invenio_sitemap/config.py         6      0   100%
invenio_sitemap/ext.py           12      0   100%
invenio_sitemap/sitemap.py        6      0   100%
invenio_sitemap/tasks.py         49      1    98%   66
invenio_sitemap/utils.py         13      0   100%
invenio_sitemap/views.py         31      0   100%
TOTAL                           157      2    99%
======================= 65 passed, 6 warnings in 10.11s ========================
 Container docker_services_cli-opensearch-1  Stopping
 Container docker_services_cli-rabbitmq-1  Stopping
 Container docker_services_cli-redis-1  Stopping
 Container docker_services_cli-postgresql-1  Stopping
 Container docker_services_cli-redis-1  Stopped
 Container docker_services_cli-redis-1  Removing
 Container docker_services_cli-postgresql-1  Stopped
 Container docker_services_cli-postgresql-1  Removing
 Container docker_services_cli-redis-1  Removed
 Container docker_services_cli-postgresql-1  Removed
 Container docker_services_cli-opensearch-1  Stopped
 Container docker_services_cli-opensearch-1  Removing
 Container docker_services_cli-opensearch-1  Removed
 Container docker_services_cli-rabbitmq-1  Stopped
 Container docker_services_cli-rabbitmq-1  Removing
 Container docker_services_cli-rabbitmq-1  Removed
 Network docker_services_cli_default  Removing
 Network docker_services_cli_default  Removed
