 postgresql Pulling 
 b0a0cf830b12 Pulling fs layer 
 dda3d8fbd5ed Pulling fs layer 
 283a477db7bb Pulling fs layer 
 91d2729fa4d5 Pulling fs layer 
 9739ced65621 Pulling fs layer 
 ae3bb1b347a4 Pulling fs layer 
 f8406d9c00ea Pulling fs layer 
 c199bff16b05 Pulling fs layer 
 e0d55fdb4d15 Pulling fs layer 
 c1cb13b19080 Pulling fs layer 
 873532e5f8c7 Pulling fs layer 
 050d9f8c3b1c Pulling fs layer 
 710e142705f8 Pulling fs layer 
 cb628c265f09 Pulling fs layer 
 e0d55fdb4d15 Waiting 
 91d2729fa4d5 Waiting 
 9739ced65621 Waiting 
 f8406d9c00ea Waiting 
 ae3bb1b347a4 Waiting 
 c199bff16b05 Waiting 
 c1cb13b19080 Waiting 
 710e142705f8 Waiting 
 873532e5f8c7 Waiting 
 050d9f8c3b1c Waiting 
 cb628c265f09 Waiting 
 dda3d8fbd5ed Downloading [========================================>          ]     933B/1.165kB
 dda3d8fbd5ed Downloading [==================================================>]  1.165kB/1.165kB
 dda3d8fbd5ed Verifying Checksum 
 dda3d8fbd5ed Download complete 
 283a477db7bb Downloading [>                                                  ]  46.48kB/4.533MB
 b0a0cf830b12 Downloading [>                                                  ]  294.9kB/29.15MB
 283a477db7bb Verifying Checksum 
 283a477db7bb Download complete 
 91d2729fa4d5 Downloading [>                                                  ]  15.83kB/1.45MB
 b0a0cf830b12 Downloading [==================================>                ]  19.84MB/29.15MB
 91d2729fa4d5 Downloading [==================================================>]   1.45MB/1.45MB
 91d2729fa4d5 Verifying Checksum 
 91d2729fa4d5 Download complete 
 9739ced65621 Downloading [>                                                  ]  82.72kB/8.069MB
 b0a0cf830b12 Verifying Checksum 
 b0a0cf830b12 Download complete 
 b0a0cf830b12 Extracting [>                                                  ]  294.9kB/29.15MB
 ae3bb1b347a4 Downloading [>                                                  ]  13.25kB/1.196MB
 9739ced65621 Downloading [=================================>                 ]  5.369MB/8.069MB
 ae3bb1b347a4 Download complete 
 f8406d9c00ea Downloading [==================================================>]     116B/116B
 f8406d9c00ea Verifying Checksum 
 f8406d9c00ea Download complete 
 9739ced65621 Download complete 
 b0a0cf830b12 Extracting [===========>                                       ]  6.488MB/29.15MB
 c199bff16b05 Downloading [==============>                                    ]     934B/3.145kB
 c199bff16b05 Downloading [==================================================>]  3.145kB/3.145kB
 c199bff16b05 Verifying Checksum 
 c199bff16b05 Download complete 
 c1cb13b19080 Downloading [====>                                              ]     933B/9.925kB
 c1cb13b19080 Downloading [==================================================>]  9.925kB/9.925kB
 c1cb13b19080 Verifying Checksum 
 c1cb13b19080 Download complete 
 e0d55fdb4d15 Downloading [>                                                  ]    536kB/109MB
 b0a0cf830b12 Extracting [=================>                                 ]  10.03MB/29.15MB
 873532e5f8c7 Downloading [==================================================>]     128B/128B
 873532e5f8c7 Verifying Checksum 
 873532e5f8c7 Download complete 
 050d9f8c3b1c Downloading [==================================================>]     169B/169B
 050d9f8c3b1c Verifying Checksum 
 050d9f8c3b1c Download complete 
 e0d55fdb4d15 Downloading [===========>                                       ]  25.09MB/109MB
 b0a0cf830b12 Extracting [=======================>                           ]  13.86MB/29.15MB
 710e142705f8 Downloading [========>                                          ]     934B/5.421kB
 710e142705f8 Downloading [==================================================>]  5.421kB/5.421kB
 710e142705f8 Verifying Checksum 
 710e142705f8 Download complete 
 e0d55fdb4d15 Downloading [======================>                            ]  49.12MB/109MB
 cb628c265f09 Downloading [==================================================>]     184B/184B
 cb628c265f09 Verifying Checksum 
 cb628c265f09 Download complete 
 b0a0cf830b12 Extracting [=====================================>             ]  21.82MB/29.15MB
 e0d55fdb4d15 Downloading [===============================>                   ]  69.44MB/109MB
 e0d55fdb4d15 Downloading [==============================================>    ]    101MB/109MB
 e0d55fdb4d15 Verifying Checksum 
 e0d55fdb4d15 Download complete 
 b0a0cf830b12 Extracting [==========================================>        ]  24.77MB/29.15MB
 b0a0cf830b12 Extracting [===============================================>   ]  27.72MB/29.15MB
 b0a0cf830b12 Extracting [================================================>  ]  28.31MB/29.15MB
 b0a0cf830b12 Extracting [==================================================>]  29.15MB/29.15MB
 b0a0cf830b12 Pull complete 
 dda3d8fbd5ed Extracting [==================================================>]  1.165kB/1.165kB
 dda3d8fbd5ed Extracting [==================================================>]  1.165kB/1.165kB
 dda3d8fbd5ed Pull complete 
 283a477db7bb Extracting [>                                                  ]  65.54kB/4.533MB
 283a477db7bb Extracting [==================================================>]  4.533MB/4.533MB
 283a477db7bb Pull complete 
 91d2729fa4d5 Extracting [=>                                                 ]  32.77kB/1.45MB
 91d2729fa4d5 Extracting [==================================================>]   1.45MB/1.45MB
 91d2729fa4d5 Pull complete 
 9739ced65621 Extracting [>                                                  ]   98.3kB/8.069MB
 9739ced65621 Extracting [========================>                          ]   4.03MB/8.069MB
 9739ced65621 Extracting [======================================>            ]  6.291MB/8.069MB
 9739ced65621 Extracting [==================================================>]  8.069MB/8.069MB
 9739ced65621 Pull complete 
 ae3bb1b347a4 Extracting [=>                                                 ]  32.77kB/1.196MB
 ae3bb1b347a4 Extracting [==================================================>]  1.196MB/1.196MB
 ae3bb1b347a4 Extracting [==================================================>]  1.196MB/1.196MB
 ae3bb1b347a4 Pull complete 
 f8406d9c00ea Extracting [==================================================>]     116B/116B
 f8406d9c00ea Extracting [==================================================>]     116B/116B
 f8406d9c00ea Pull complete 
 c199bff16b05 Extracting [==================================================>]  3.145kB/3.145kB
 c199bff16b05 Extracting [==================================================>]  3.145kB/3.145kB
 c199bff16b05 Pull complete 
 e0d55fdb4d15 Extracting [>                                                  ]  557.1kB/109MB
 e0d55fdb4d15 Extracting [===>                                               ]  7.799MB/109MB
 e0d55fdb4d15 Extracting [=====>                                             ]  12.26MB/109MB
 e0d55fdb4d15 Extracting [=======>                                           ]  17.27MB/109MB
 e0d55fdb4d15 Extracting [==========>                                        ]  22.84MB/109MB
 e0d55fdb4d15 Extracting [=============>                                     ]  30.08MB/109MB
 e0d55fdb4d15 Extracting [==================>                                ]  39.55MB/109MB
 e0d55fdb4d15 Extracting [======================>                            ]  49.02MB/109MB
 e0d55fdb4d15 Extracting [=========================>                         ]  54.59MB/109MB
 e0d55fdb4d15 Extracting [============================>                      ]  61.28MB/109MB
 e0d55fdb4d15 Extracting [================================>                  ]  71.86MB/109MB
 e0d55fdb4d15 Extracting [=====================================>             ]  80.77MB/109MB
 e0d55fdb4d15 Extracting [=========================================>         ]  90.24MB/109MB
 e0d55fdb4d15 Extracting [==========================================>        ]  93.59MB/109MB
 e0d55fdb4d15 Extracting [============================================>      ]  97.48MB/109MB
 e0d55fdb4d15 Extracting [==============================================>    ]  101.4MB/109MB
 e0d55fdb4d15 Extracting [===============================================>   ]  103.6MB/109MB
 e0d55fdb4d15 Extracting [================================================>  ]  105.3MB/109MB
 e0d55fdb4d15 Extracting [=================================================> ]  107.5MB/109MB
 e0d55fdb4d15 Extracting [==================================================>]    109MB/109MB
 e0d55fdb4d15 Pull complete 
 c1cb13b19080 Extracting [==================================================>]  9.925kB/9.925kB
 c1cb13b19080 Extracting [==================================================>]  9.925kB/9.925kB
 c1cb13b19080 Pull complete 
 873532e5f8c7 Extracting [==================================================>]     128B/128B
 873532e5f8c7 Extracting [==================================================>]     128B/128B
 873532e5f8c7 Pull complete 
 050d9f8c3b1c Extracting [==================================================>]     169B/169B
 050d9f8c3b1c Extracting [==================================================>]     169B/169B
 050d9f8c3b1c Pull complete 
 710e142705f8 Extracting [==================================================>]  5.421kB/5.421kB
 710e142705f8 Extracting [==================================================>]  5.421kB/5.421kB
 710e142705f8 Pull complete 
 cb628c265f09 Extracting [==================================================>]     184B/184B
 cb628c265f09 Extracting [==================================================>]     184B/184B
 cb628c265f09 Pull complete 
 postgresql Pulled 
 Network docker_services_cli_default  Creating
 Network docker_services_cli_default  Created
 Container docker_services_cli-postgresql-1  Creating
 Container docker_services_cli-postgresql-1  Created
 Container docker_services_cli-postgresql-1  Starting
 Container docker_services_cli-postgresql-1  Started
============================= test session starts ==============================
platform linux -- Python 3.12.12, pytest-8.4.2, pluggy-1.6.0 -- /home/runner/work/invenio-testrig/invenio-testrig/package-repo/.venv/bin/python
cachedir: .pytest_cache
rootdir: /home/runner/work/invenio-testrig/invenio-testrig/package-repo
configfile: setup.cfg
testpaths: tests, invenio_db
plugins: github-actions-annotate-failures-0.3.0, pycodestyle-2.5.0, flask-1.3.0, black-ng-0.4.1, invenio-3.4.2, isort-4.0.0, cov-7.0.0, pydocstyle-2.4.0
collecting ... collected 75 items

tests/conftest.py::PYDOCSTYLE PASSED
tests/conftest.py::ISORT PASSED
tests/conftest.py::black PASSED
tests/demo/__init__.py::PYDOCSTYLE PASSED
tests/demo/__init__.py::ISORT PASSED
tests/demo/__init__.py::black PASSED
tests/demo/child.py::PYDOCSTYLE PASSED
tests/demo/child.py::ISORT PASSED
tests/demo/child.py::black PASSED
tests/demo/parent.py::PYDOCSTYLE PASSED
tests/demo/parent.py::ISORT PASSED
tests/demo/parent.py::black PASSED
tests/demo/versioned_a.py::PYDOCSTYLE PASSED
tests/demo/versioned_a.py::ISORT PASSED
tests/demo/versioned_a.py::black PASSED
tests/demo/versioned_b.py::PYDOCSTYLE PASSED
tests/demo/versioned_b.py::ISORT PASSED
tests/demo/versioned_b.py::black PASSED
tests/mocks.py::PYDOCSTYLE PASSED
tests/mocks.py::ISORT PASSED
tests/mocks.py::black PASSED
tests/test_db.py::ISORT PASSED
tests/test_db.py::black PASSED
tests/test_db.py::test_init PASSED
tests/test_db.py::test_alembic PASSED::warning file=/home/runner/work/invenio-testrig/invenio-testrig/package-repo/.venv/lib/python3.12/site-packages/alembic/config.py,line=566::No path_separator found in configuration; falling back to legacy splitting on spaces/commas for version_locations.  Consider adding path_separator=os to Alembic config.

tests/test_db.py::test_naming_convention PASSED::warning file=/home/runner/work/invenio-testrig/invenio-testrig/package-repo/.venv/lib/python3.12/site-packages/alembic/config.py,line=566::No path_separator found in configuration; falling back to legacy splitting on spaces/commas for version_locations.  Consider adding path_separator=os to Alembic config.
::warning file=/home/runner/work/invenio-testrig/invenio-testrig/package-repo/.venv/lib/python3.12/site-packages/alembic/config.py,line=566::No path_separator found in configuration; falling back to legacy splitting on spaces/commas for version_locations.  Consider adding path_separator=os to Alembic config.

tests/test_db.py::test_transaction PASSED
tests/test_db.py::test_entry_points PASSED::warning file=/home/runner/work/invenio-testrig/invenio-testrig/package-repo/.venv/lib/python3.12/site-packages/alembic/config.py,line=566::No path_separator found in configuration; falling back to legacy splitting on spaces/commas for version_locations.  Consider adding path_separator=os to Alembic config.

tests/test_db.py::test_local_proxy PASSED
tests/test_db.py::test_db_create_alembic_upgrade PASSED::warning file=/home/runner/work/invenio-testrig/invenio-testrig/package-repo/.venv/lib/python3.12/site-packages/alembic/config.py,line=566::No path_separator found in configuration; falling back to legacy splitting on spaces/commas for version_locations.  Consider adding path_separator=os to Alembic config.

tests/test_uow.py::ISORT PASSED
tests/test_uow.py::black PASSED
tests/test_uow.py::test_uow_lifecycle PASSED
tests/test_uow.py::test_uow_transactions PASSED
tests/test_utils.py::ISORT PASSED
tests/test_utils.py::black PASSED
tests/test_utils.py::test_rebuild_encrypted_properties PASSED
tests/test_utils.py::test_versioning_model_classname PASSED
tests/test_versioning.py::ISORT PASSED
tests/test_versioning.py::black PASSED
tests/test_versioning.py::test_disabled_versioning PASSED
tests/test_versioning.py::test_disabled_versioning_with_custom_table[False-1] PASSED
tests/test_versioning.py::test_disabled_versioning_with_custom_table[True-3] PASSED
tests/test_versioning.py::test_versioning PASSED
tests/test_versioning.py::test_versioning_without_versioned_tables PASSED
invenio_db/__init__.py::PYDOCSTYLE PASSED
invenio_db/__init__.py::ISORT PASSED
invenio_db/__init__.py::black PASSED
invenio_db/alembic/35c1075e6360_force_naming_convention.py::PYDOCSTYLE PASSED
invenio_db/alembic/35c1075e6360_force_naming_convention.py::ISORT PASSED
invenio_db/alembic/35c1075e6360_force_naming_convention.py::black PASSED
invenio_db/alembic/96e796392533_create_database_migrations.py::PYDOCSTYLE PASSED
invenio_db/alembic/96e796392533_create_database_migrations.py::ISORT PASSED
invenio_db/alembic/96e796392533_create_database_migrations.py::black PASSED
invenio_db/alembic/dbdbc1b19cf2_create_transaction_table.py::PYDOCSTYLE PASSED
invenio_db/alembic/dbdbc1b19cf2_create_transaction_table.py::ISORT PASSED
invenio_db/alembic/dbdbc1b19cf2_create_transaction_table.py::black PASSED
invenio_db/cli.py::PYDOCSTYLE PASSED
invenio_db/cli.py::ISORT PASSED
invenio_db/cli.py::black PASSED
invenio_db/ext.py::PYDOCSTYLE PASSED
invenio_db/ext.py::ISORT PASSED
invenio_db/ext.py::black PASSED
invenio_db/proxies.py::PYDOCSTYLE PASSED
invenio_db/proxies.py::ISORT PASSED
invenio_db/proxies.py::black PASSED
invenio_db/shared.py::PYDOCSTYLE PASSED
invenio_db/shared.py::ISORT PASSED
invenio_db/shared.py::black PASSED
invenio_db/uow.py::PYDOCSTYLE PASSED
invenio_db/uow.py::ISORT PASSED
invenio_db/uow.py::black PASSED
invenio_db/utils.py::PYDOCSTYLE PASSED
invenio_db/utils.py::ISORT PASSED
invenio_db/utils.py::black PASSED

=============================== warnings summary ===============================
tests/test_db.py::test_alembic
tests/test_db.py::test_naming_convention
tests/test_db.py::test_naming_convention
tests/test_db.py::test_entry_points
tests/test_db.py::test_db_create_alembic_upgrade
  /home/runner/work/invenio-testrig/invenio-testrig/package-repo/.venv/lib/python3.12/site-packages/alembic/config.py:566: DeprecationWarning: No path_separator found in configuration; falling back to legacy splitting on spaces/commas for version_locations.  Consider adding path_separator=os to Alembic config.
    util.warn_deprecated(

-- Docs: https://docs.pytest.org/en/stable/how-to/capture-warnings.html
- generated xml file: /home/runner/work/invenio-testrig/invenio-testrig/artifacts/test-report-patched.xml -
================================ tests coverage ================================
_______________ coverage: platform linux, python 3.12.12-final-0 _______________

Name                                                            Stmts   Miss  Cover   Missing
---------------------------------------------------------------------------------------------
invenio_db/__init__.py                                              4      0   100%
invenio_db/alembic/35c1075e6360_force_naming_convention.py         57      2    96%   86, 107
invenio_db/alembic/96e796392533_create_database_migrations.py       8      0   100%
invenio_db/alembic/dbdbc1b19cf2_create_transaction_table.py        16      0   100%
invenio_db/cli.py                                                  58      5    91%   23, 102-105
invenio_db/ext.py                                                  65      3    95%   42, 98-99
invenio_db/proxies.py                                               3      0   100%
invenio_db/shared.py                                               33     18    45%   38-84, 94-96, 106
invenio_db/uow.py                                                  79     16    80%   143-144, 148, 188, 244-259
invenio_db/utils.py                                                61      5    92%   97-98, 115, 128-130
---------------------------------------------------------------------------------------------
TOTAL                                                             384     49    87%
======================== 75 passed, 5 warnings in 6.95s ========================
 Container docker_services_cli-postgresql-1  Stopping
 Container docker_services_cli-postgresql-1  Stopped
 Container docker_services_cli-postgresql-1  Removing
 Container docker_services_cli-postgresql-1  Removed
 Network docker_services_cli_default  Removing
 Network docker_services_cli_default  Removed
