running extract_messages
extracting messages from invenio_formatter/__init__.py (encoding="utf-8")
extracting messages from invenio_formatter/config.py (encoding="utf-8")
extracting messages from invenio_formatter/ext.py (encoding="utf-8")
extracting messages from invenio_formatter/views.py (encoding="utf-8")
extracting messages from invenio_formatter/context_processors/__init__.py (encoding="utf-8")
extracting messages from invenio_formatter/context_processors/badges.py (encoding="utf-8")
extracting messages from invenio_formatter/filters/__init__.py (encoding="utf-8")
extracting messages from invenio_formatter/filters/datetime.py (encoding="utf-8")
extracting messages from invenio_formatter/filters/html.py (encoding="utf-8")
extracting messages from invenio_formatter/templates/invenio_formatter/macros/badges.html (encoding="utf-8")
extracting messages from invenio_formatter/templates/invenio_formatter/macros/meta.html (encoding="utf-8")
extracting messages from invenio_formatter/templates/semantic-ui/invenio_formatter/macros/badges.html (encoding="utf-8")
extracting messages from invenio_formatter/templates/semantic-ui/invenio_formatter/macros/meta.html (encoding="utf-8")
writing PO template file to /dev/null
============================= test session starts ==============================
platform linux -- Python 3.12.12, pytest-8.4.2, pluggy-1.6.0 -- /home/runner/work/invenio-testrig/invenio-testrig/package-repo/.venv/bin/python
cachedir: .pytest_cache
rootdir: /home/runner/work/invenio-testrig/invenio-testrig/package-repo
configfile: setup.cfg
testpaths: tests, invenio_formatter
plugins: github-actions-annotate-failures-0.3.0, pycodestyle-2.5.0, flask-1.3.0, black-ng-0.4.1, invenio-3.4.2, isort-4.0.0, cov-7.0.0, pydocstyle-2.4.0
collecting ... collected 64 items

tests/conftest.py::PYDOCSTYLE PASSED
tests/conftest.py::ISORT PASSED
tests/conftest.py::black PASSED
tests/test_examples_app.py::ISORT PASSED
tests/test_examples_app.py::black PASSED
tests/test_examples_app.py::test_example_app [31m[1mWARNING: This is a development server. Do not use it in a production deployment. Use a production WSGI server instead.[0m
 * Running on http://127.0.0.1:5000
[33mPress CTRL+C to quit[0m
  % Total    % Received % Xferd  Average Speed   Time    Time     Time  Current
                                 Dload  Upload   Total   Spent    Left  Speed
  0     0    0     0    0     0      0      0 --:--:-- --:--:-- --:--:--     0127.0.0.1 - - [10/Dec/2025 09:53:18] "GET / HTTP/1.1" 200 -
100   116  100   116    0     0   5358      0 --:--:-- --:--:-- --:--:--  5523
PASSED
tests/test_filters.py::ISORT PASSED
tests/test_filters.py::black PASSED
tests/test_filters.py::test_from_isodate PASSED
tests/test_filters.py::test_from_isodatetime PASSED
tests/test_filters.py::test_sanitize_html[<a href="data:text/html;base64,PHNjcmlwdD5hbGVydChkb2N1bWVudC5kb21haW4pPC9zY3JpcHQ+Cg==">XSS</a>-&lt;a&gt;XSS&lt;/a&gt;] PASSED
tests/test_filters.py::test_sanitize_html[<svg/onload=alert(document.origin)>-] PASSED
tests/test_filters.py::test_sanitize_html[<img src='x' onerror='alert(document.domain)' />-] PASSED
tests/test_invenio_formatter.py::ISORT PASSED
tests/test_invenio_formatter.py::black PASSED
tests/test_invenio_formatter.py::test_version PASSED
tests/test_invenio_formatter.py::test_init PASSED
tests/test_invenio_formatter.py::test_badge_enable_disable PASSED
tests/test_template_context_processors.py::ISORT PASSED
tests/test_template_context_processors.py::black PASSED
tests/test_template_context_processors.py::test_context_processor_badge_svg PASSED
tests/test_template_context_processors.py::test_context_processor_badge_png PASSED
tests/test_template_macros.py::ISORT PASSED
tests/test_template_macros.py::black PASSED
tests/test_template_macros.py::test_meta_twittercard PASSED
tests/test_template_macros.py::test_meta_opengraph PASSED
tests/test_template_macros.py::test_meta_highwire PASSED
tests/test_template_macros.py::test_meta_badges_formats_list PASSED
tests/test_views.py::ISORT PASSED
tests/test_views.py::black PASSED
tests/test_views.py::test_views_badge_svg PASSED

tests/test_views.py::test_views_badge_svg_mapping PASSED

tests/test_views.py::test_views_badge_png PASSED

tests/test_views.py::test_views_badge_etag PASSED

tests/test_views.py::test_views_badge_no_cache_headers PASSED

tests/test_views.py::test_views_badge_color_parameter PASSED

invenio_formatter/__init__.py::PYDOCSTYLE PASSED
invenio_formatter/__init__.py::ISORT PASSED
invenio_formatter/__init__.py::black PASSED
invenio_formatter/__init__.py::invenio_formatter PASSED
invenio_formatter/config.py::PYDOCSTYLE PASSED
invenio_formatter/config.py::ISORT PASSED
invenio_formatter/config.py::black PASSED
invenio_formatter/context_processors/__init__.py::PYDOCSTYLE PASSED
invenio_formatter/context_processors/__init__.py::ISORT PASSED
invenio_formatter/context_processors/__init__.py::black PASSED
invenio_formatter/context_processors/badges.py::PYDOCSTYLE PASSED
invenio_formatter/context_processors/badges.py::ISORT PASSED
invenio_formatter/context_processors/badges.py::black PASSED
invenio_formatter/ext.py::PYDOCSTYLE PASSED
invenio_formatter/ext.py::ISORT PASSED
invenio_formatter/ext.py::black PASSED
invenio_formatter/filters/__init__.py::PYDOCSTYLE PASSED
invenio_formatter/filters/__init__.py::ISORT PASSED
invenio_formatter/filters/__init__.py::black PASSED
invenio_formatter/filters/datetime.py::PYDOCSTYLE PASSED
invenio_formatter/filters/datetime.py::ISORT PASSED
invenio_formatter/filters/datetime.py::black PASSED
invenio_formatter/filters/html.py::PYDOCSTYLE PASSED
invenio_formatter/filters/html.py::ISORT PASSED
invenio_formatter/filters/html.py::black PASSED
invenio_formatter/views.py::PYDOCSTYLE PASSED
invenio_formatter/views.py::ISORT PASSED
invenio_formatter/views.py::black PASSED

=============================== warnings summary ===============================
tests/test_views.py::test_views_badge_svg
tests/test_views.py::test_views_badge_svg_mapping
tests/test_views.py::test_views_badge_svg_mapping
tests/test_views.py::test_views_badge_png
tests/test_views.py::test_views_badge_etag
tests/test_views.py::test_views_badge_etag
tests/test_views.py::test_views_badge_no_cache_headers
tests/test_views.py::test_views_badge_color_parameter
    response.last_modified = dt.utcnow()

- generated xml file: /home/runner/work/invenio-testrig/invenio-testrig/artifacts/test-report-patched.xml -
================================ tests coverage ================================
_______________ coverage: platform linux, python 3.12.12-final-0 _______________

Name                                               Stmts   Miss  Cover   Missing
invenio_formatter/__init__.py                          3      0   100%
invenio_formatter/config.py                            6      0   100%
invenio_formatter/context_processors/__init__.py       0      0   100%
invenio_formatter/context_processors/badges.py        28      0   100%
invenio_formatter/ext.py                              28      0   100%
invenio_formatter/filters/__init__.py                  0      0   100%
invenio_formatter/filters/datetime.py                 17      3    82%   65-68
invenio_formatter/filters/html.py                      4      0   100%
invenio_formatter/views.py                            36      1    97%   21
TOTAL                                                122      4    97%
======================== 64 passed, 8 warnings in 8.78s ========================
